{
  "schema": "skenion.package.listing",
  "schemaVersion": "0.1.0",
  "packageId": "skenion/examples",
  "version": "0.45.0",
  "displayName": "Skenion Examples",
  "summary": "Reusable example patches for learning Skenion.",
  "description": "A public marketplace listing projection for the example patch package.",
  "category": "patch",
  "tags": [
    "examples",
    "audio"
  ],
  "license": "Apache-2.0",
  "homepageUrl": "https://skenion.dev/examples",
  "repositoryUrl": "https://github.com/skenion/skenion-examples",
  "contracts": {
    "line": "0.45",
    "range": ">=0.45.0 <0.46.0"
  },
  "targetSupport": {
    "kind": "target-independent",
    "summary": "Patch package; no native runtime target is required."
  },
  "provides": {
    "patches": [
      {
        "id": "example.oscillator",
        "description": "Basic oscillator patch."
      }
    ],
    "help": [
      {
        "id": "example.oscillator",
        "description": "Oscillator help and walkthrough."
      }
    ],
    "capabilities": [
      "patch-library"
    ]
  },
  "artifactEvidence": {
    "artifacts": [
      {
        "kind": "manifest",
        "path": "skenion.package.json",
        "checksum": {
          "algorithm": "sha256",
          "value": "aaaaaaaaaaaaaaaaaaaaaaaaaaaaaaaaaaaaaaaaaaaaaaaaaaaaaaaaaaaaaaaa"
        },
        "evidenceRefs": [
          "manifest-checksum"
        ]
      }
    ],
    "evidence": [
      {
        "id": "manifest-checksum",
        "kind": "checksum",
        "path": "evidence/manifest.sha256",
        "checksum": {
          "algorithm": "sha256",
          "value": "bbbbbbbbbbbbbbbbbbbbbbbbbbbbbbbbbbbbbbbbbbbbbbbbbbbbbbbbbbbbbbbb"
        }
      }
    ]
  },
  "discoverySignals": {
    "stargazerCount": 128,
    "rankingScore": 0.92
  },
  "diagnostics": []
}
